{
  "kind": "market.listings",
  "$comment": "Functional Specification 11.2: a neutral recovery station keeps the starter ship - its hull, its basic modules and their ammunition - at fixed, non-scarce prices. Each is quoted at or below its reference value, so a pilot the recovery service does not re-equip, who holds at least the starter ship's reference value, can always buy that ship back (Functional Specification 9.12, 22.1).",
  "stationId": "station.borrell.harbour",
  "listings": [
    {
      "itemId": "hull.independent.starter",
      "supply": "fixed",
      "basePriceCredits": 11100,
      "regionalPriceFactor": 1,
      "targetStock": 10,
      "initialStock": 10,
      "elasticity": 0.3,
      "baseSpread": 0.08,
      "productionPerHour": 0,
      "consumptionPerHour": 0
    },
    {
      "itemId": "module.turret.autocannon.small",
      "supply": "fixed",
      "basePriceCredits": 11111,
      "regionalPriceFactor": 1,
      "targetStock": 20,
      "initialStock": 20,
      "elasticity": 0.3,
      "baseSpread": 0.08,
      "productionPerHour": 0,
      "consumptionPerHour": 0
    },
    {
      "itemId": "ammo.projectile.small.fusion",
      "supply": "fixed",
      "basePriceCredits": 8,
      "regionalPriceFactor": 1,
      "targetStock": 2000,
      "initialStock": 2000,
      "elasticity": 0.3,
      "baseSpread": 0.08,
      "productionPerHour": 0,
      "consumptionPerHour": 0
    },
    {
      "itemId": "module.shield.booster.small",
      "supply": "fixed",
      "basePriceCredits": 7870,
      "regionalPriceFactor": 1,
      "targetStock": 20,
      "initialStock": 20,
      "elasticity": 0.3,
      "baseSpread": 0.08,
      "productionPerHour": 0,
      "consumptionPerHour": 0
    },
    {
      "itemId": "module.turret.railgun.small",
      "supply": "dynamic",
      "basePriceCredits": 16000,
      "regionalPriceFactor": 1,
      "targetStock": 12,
      "initialStock": 9,
      "elasticity": 0.3,
      "baseSpread": 0.08,
      "productionPerHour": 0.2,
      "consumptionPerHour": 0
    },
    {
      "itemId": "module.propulsion.afterburner.small",
      "supply": "dynamic",
      "basePriceCredits": 9500,
      "regionalPriceFactor": 1,
      "targetStock": 14,
      "initialStock": 12,
      "elasticity": 0.3,
      "baseSpread": 0.08,
      "productionPerHour": 0.2,
      "consumptionPerHour": 0
    },
    {
      "itemId": "module.repair.armor.small",
      "supply": "dynamic",
      "basePriceCredits": 8000,
      "regionalPriceFactor": 1,
      "targetStock": 16,
      "initialStock": 14,
      "elasticity": 0.3,
      "baseSpread": 0.08,
      "productionPerHour": 0.25,
      "consumptionPerHour": 0
    },
    {
      "itemId": "module.plating.armor.small",
      "supply": "dynamic",
      "basePriceCredits": 4000,
      "regionalPriceFactor": 1,
      "targetStock": 24,
      "initialStock": 22,
      "elasticity": 0.3,
      "baseSpread": 0.08,
      "productionPerHour": 0.4,
      "consumptionPerHour": 0
    },
    {
      "itemId": "module.capacitor.battery.small",
      "supply": "dynamic",
      "basePriceCredits": 6000,
      "regionalPriceFactor": 1,
      "targetStock": 18,
      "initialStock": 16,
      "elasticity": 0.3,
      "baseSpread": 0.08,
      "productionPerHour": 0.3,
      "consumptionPerHour": 0
    },
    {
      "itemId": "ammo.projectile.small.phased",
      "supply": "dynamic",
      "basePriceCredits": 14,
      "regionalPriceFactor": 1,
      "targetStock": 1500,
      "initialStock": 1400,
      "elasticity": 0.3,
      "baseSpread": 0.08,
      "productionPerHour": 30,
      "consumptionPerHour": 0
    },
    {
      "itemId": "ammo.hybrid.small.iron",
      "supply": "dynamic",
      "basePriceCredits": 11,
      "regionalPriceFactor": 1,
      "targetStock": 1500,
      "initialStock": 1500,
      "elasticity": 0.3,
      "baseSpread": 0.08,
      "productionPerHour": 30,
      "consumptionPerHour": 0
    },
    {
      "itemId": "ammo.hybrid.small.plasma",
      "supply": "dynamic",
      "basePriceCredits": 16,
      "regionalPriceFactor": 1,
      "targetStock": 1200,
      "initialStock": 1100,
      "elasticity": 0.3,
      "baseSpread": 0.08,
      "productionPerHour": 25,
      "consumptionPerHour": 0
    },
    {
      "itemId": "item.salvage.alloy",
      "supply": "dynamic",
      "basePriceCredits": 1400,
      "regionalPriceFactor": 1,
      "targetStock": 60,
      "initialStock": 45,
      "elasticity": 0.45,
      "baseSpread": 0.08,
      "productionPerHour": 0,
      "consumptionPerHour": 1.5
    },
    {
      "itemId": "item.salvage.circuitry",
      "supply": "dynamic",
      "basePriceCredits": 2400,
      "regionalPriceFactor": 1,
      "targetStock": 40,
      "initialStock": 30,
      "elasticity": 0.5,
      "baseSpread": 0.08,
      "productionPerHour": 0,
      "consumptionPerHour": 1
    },
    {
      "itemId": "item.commodity.coolant",
      "supply": "dynamic",
      "basePriceCredits": 300,
      "regionalPriceFactor": 1,
      "targetStock": 200,
      "initialStock": 180,
      "elasticity": 0.2,
      "baseSpread": 0.08,
      "productionPerHour": 12,
      "consumptionPerHour": 10
    }
  ]
}
